{
  "generated_at": "2026-02-23T09:00:00Z",
  "timeframe_filter": null,
  "total_rows": 8640,
  "first_evaluated_at": "2026-02-20T09:00:00Z",
  "last_evaluated_at": "2026-02-23T09:00:00Z",
  "days_covered": 3.0,
  "by_timeframe": [
    {
      "timeframe": "1m",
      "rows": 2880,
      "first_evaluated_at": "2026-02-20T09:00:00Z",
      "last_evaluated_at": "2026-02-23T09:00:00Z",
      "days_covered": 3.0
    },
    {
      "timeframe": "15m",
      "rows": 2880,
      "first_evaluated_at": "2026-02-20T09:00:00Z",
      "last_evaluated_at": "2026-02-23T09:00:00Z",
      "days_covered": 3.0
    },
    {
      "timeframe": "1h",
      "rows": 2880,
      "first_evaluated_at": "2026-02-20T09:00:00Z",
      "last_evaluated_at": "2026-02-23T09:00:00Z",
      "days_covered": 3.0
    }
  ]
}
